,Unnamed: 0,text,language
674,674,"This marked a significant increase over January 2006, when the rank was number 33, with Wikipedia receiving around 18.3 million unique visitors.",English
675,675,"The estimates for reinvestment by industrial organizations into internal research and development was studied by Adam Jaffe, who recorded that the range of 4% to 25% annually was to be recommended, with high-end technology requiring the higher level of support for internal reinvestment.",English
676,676,"Ocean currents are another important factor in determining climate, particularly the major underwater thermohaline circulation which distributes heat energy from the equatorial oceans to the polar regions.",English
677,677,Artificial neurons and edges typically have a weight that adjusts as learning proceeds.,English
678,678,The original release cover caused controversy and was replaced in some countries.,English
679,679,"According to Andrew Lih, the current expansion of Wikipedia to millions of articles would be difficult to envision without the use of such bots.",English
680,680,"A subset of machine learning is closely related to computational statistics, which focuses on making predictions using computers; but not all machine learning is statistical learning.",English
681,681,"The cartoon referred to Chelsea Elizabeth Manning (born Bradley Edward Manning), an American activist, politician, and former United States Army soldier and a trans woman.",English
682,682,A claim that is likely to be challenged requires a reference to a reliable source.,English
683,683,An editorial in The Guardian in 2014 claimed that more effort went into providing references for a list of female porn actors than a list of women writers.,English
684,684,"This follows Alan Turing's proposal in his paper ""Computing Machinery and Intelligence"", in which the question ""Can machines think?""",English
685,685,what your mistake was come let's feed you something nice from that day onwards.,English
686,686,"Some of the training examples are missing training labels,  yet many machine-learning researchers have found that unlabeled data, when used in conjunction with a small amount of labeled data, can produce a considerable improvement in learning accuracy.",English
687,687,to tell me which of these ten words was your favorite smart word number six is in a fix in a fix means to be in a troublesome situation for example boy i'm in a fix because i've made plans with two different friends for this evening.,English
688,688,"Jimmy Wales once argued that only ""a community ... a dedicated group of a few hundred volunteers"" makes the bulk of contributions to Wikipedia and that the project is therefore ""much like any traditional organization"".",English
689,689,"Because of this, universities throughout the United States tried to encourage females to become Wikipedia contributors.",English
690,690,"One privacy concern in the case of Wikipedia is the right of a private citizen to remain a ""private citizen"" rather than a ""public figure"" in the eyes of the law.",English
691,691,today i could do with a energy drink other words that you can use in place of sluggish could be lethargic or dragging my feet so those were the 10 smart words and before.,English
692,692,"The foundation's 2013 IRS Form 990 shows revenue of $39.7 million and expenses of almost $29 million, with assets of $37.2 million and liabilities of about $2.3 million.",English
693,693,"re not to care to know"".",English
694,694,"The extent of the current extinction event is still being researched, debated and calculated by biologists.",English
695,695,"During the Neoproterozoic era, freezing temperatures covered much of the Earth in glaciers and ice sheets.",English
696,696,"Probabilistic reasoning was also employed, especially in automated medical diagnosis.",English
697,697,i'm not at liberty to say.,English
698,698,Some of this debris re-enters the atmosphere periodically.,English
699,699,three if you want to ask you what have you been doing.,English
700,700,she thought herself too great to do any work many suitors came to ask for narcissus hand in marriage.,English
701,701,"A stream is a flowing body of water with a current, confined within a bed and stream banks.",English
702,702,"Classification algorithms are used when the outputs are restricted to a limited set of values, and regression algorithms are used when the outputs may have any numerical value within a range.",English
703,703,you can say sorry.,English
704,704,"can you speak a little more slowly, please?",English
705,705,"During the COVID-19 pandemic, Wikipedia's coverage of the pandemic received international media attention, and brought an increase in Wikipedia readership overall.",English
706,706,This exposure alternates as the Earth revolves in its orbit.,English
707,707,"Some activities, such as hunting and fishing, are used for both sustenance and leisure, often by different people.",English
708,708,"Where as, a machine learning algorithm for stock trading may inform the trader of future potential predictions.",English
709,709,Several other methods of mobile access to Wikipedia have emerged.,English
710,710,"This more traditional concept of natural things that can still be found today implies a distinction between the natural and the artificial, with the artificial being understood as that which has been brought into being by a human consciousness or a human mind.",English
711,711,Editors of traditional reference works such as the Encyclopædia Britannica have questioned the project's utility and status as an encyclopedia.,English
712,712,"An ANN is a model based on a collection of connected units or nodes called ""artificial neurons"", which loosely model the neurons in a biological brain.",English
713,713,A particularly contentious article may be locked so that only administrators are able to make changes.,English
714,714,Various types of models have been used and researched for machine learning systems.,English
715,715,"This incident led to policy changes at Wikipedia, specifically targeted at tightening up the verifiability of biographical articles of living people.",English
716,716,"Under this system, new and unregistered users' edits to certain controversial or vandalism-prone articles are reviewed by established users before they are published.",English
717,717,"Almost half of Wikipedia readers visit the site more than five times a month, and a similar number of readers specifically look for Wikipedia in search engine results.",English
718,718,i'd be glad to help.,English
719,719,Trained models derived from biased data can result in skewed or undesired predictions.,English
720,720,"""The worry is that, if you can get all that information from Wikipedia, what's left for biography?""",English
721,721,"sorry, i didn't catch that.",English
722,722,"This line, too, was continued outside the AI/CS field, as ""connectionism"", by researchers from other disciplines including Hopfield, Rumelhart and Hinton.",English
723,723,"However, a vitalist vision of nature, closer to the presocratic one, got reborn at the same time, especially after Charles Darwin.",English
724,724,Sparse dictionary learning has also been applied in image de-noising.,English
725,725,there's too much on my plate i'm drowning in work.,English
726,726,"Although machine learning has been transformative in some fields, machine-learning programs often fail to deliver expected results.",English
727,727,This is known as a neutral point of view (NPOV).,English
728,728,"i'm free all weekend, let's do something.",English
729,729,another example of catch-22 is you need a bank loan because you don't have enough.,English
730,730,"Wilderness areas and protected parks are considered important for the survival of certain species, ecological studies, conservation, and solitude.",English
731,731,A machine learning system trained on current customers only may not be able to predict the needs of new customer groups that are not represented in the training data.,English
732,732,i ask and then i say in the end.,English
733,733,"These include muscles, which are able to contract and control locomotion, and a nervous system, which sends and processes signals.",English
734,734,"Although humans comprise only a minuscule proportion of the total living biomass on Earth, the human effect on nature is disproportionately large.",English
735,735,"This is while Wikipedia faces ""a more concerning problem"" than funding, namely ""a flattening growth rate in the number of contributors to the website"".",English
736,736,you're so much better than the problem you are crying about it's not worth your tears.,English
737,737,A core objective of a learner is to generalize from its experience.,English
738,738,"yeah, of course.",English
739,739,"For instance, Chris Anderson, the editor-in-chief of Wired Magazine, wrote in Nature that the ""wisdom of crowds"" approach of Wikipedia will not displace top scientific journals, with their rigorous peer review process.",English
740,740,l woke up she was all smiles and giggles here sweetheart tell me what did you dream about.,English
741,741,"Several languages of Wikipedia also maintain a reference desk, where volunteers answer questions from the general public.",English
742,742,The discipline of machine learning employs various approaches to teach computers to accomplish tasks where no fully satisfactory algorithm is available.,English
743,743,"In 2007, readers of brandchannel.com voted Wikipedia as the fourth-highest brand ranking, receiving 15 percent of the votes in answer to the question ""Which brand had the most impact on our lives in 2006?",English
744,744,would you like me to give yo a ride home?,English
745,745,"i don't know what day is it when you're watching this video, but if it's friday for example weekend.",English
746,746,has she i guess she wouldn't want any more gold bread now huh you know.,English
