,Unnamed: 0,text,language
497,497,can you repeat it?.,English
498,498,A river is part of the hydrological cycle.,English
499,499,it doesn't matter if you want to wish somebody luck.,English
500,500,and an acute angle is this sharp angle less than 90 degrees so acute as a word is used to denote sharp and therefore also mentally sharp and obtuse is denoting blunt and .therefore also a little slow in the mind so example sentences with obtuse are the man was so obtuse that he gave away his password to a fake caller or the obtuse child.,English
501,501,"If we did, we would remove it.",English
502,502,the golden bread once upon a time in a tiny village there lived a woman named marion.,English
503,503,beats me.,English
504,504,"A Harvard law textbook, Legal Research in a Nutshell (2011), cites Wikipedia as a ""general source"" that ""can be a real boon"" in ""coming up to speed in the law governing a situation"" and, ""while not authoritative, can provide basic facts as well as leads to more in-depth resources"".",English
505,505,so you meet someone and you time how is it going?.,English
506,506,thanking people.,English
507,507,"For example, the algorithms could be designed to provide patients with unnecessary tests or medication in which the algorithm's proprietary owners hold stakes.",English
508,508,"unfortunately, i have to say no.",English
509,509,"In 2018, a self-driving car from Uber failed to detect a pedestrian, who was killed after a collision.",English
510,510,Nature and wildness have been important subjects in various eras of world history.,English
511,511,i was wondering if yo could help me with this.,English
512,512,"In addition to the point-for-point disagreement between these two parties, others have examined the sample size and selection method used in the Nature effort, and suggested a ""flawed study design"" (in Nature's manual selection of articles, in part or in whole, for comparison), absence of statistical analysis (e.g., of reported confidence intervals), and a lack of study ""statistical power"" (i.e., owing to small sample size, 42 or 4 × 101 articles compared, vs >105 and >106 set sizes for Britannica and the English Wikipedia, respectively).",English
513,513,and you're like oh that that explains it that explains it.,English
514,514,"It shifted focus away from the symbolic approaches it had inherited from AI, and toward methods and models borrowed from statistics and probability theory.",English
515,515,"As of 2019[update], page requests are first passed to a front-end layer of Varnish caching servers.",English
516,516,"Many parodies target Wikipedia's openness and susceptibility to inserted inaccuracies, with characters vandalizing or modifying the online encyclopedia project's articles.",English
517,517,thanks a million.,English
518,518,can i get you a glass of water?,English
519,519,hey guys welcome to my channel in this video.,English
520,520,"In its application across business problems, machine learning is also referred to as predictive analytics.",English
521,521,how is it going?,English
522,522,With a few exceptions—most notably the two phyla consisting of sponges and placozoans—animals have bodies that are differentiated into tissues.,English
523,523,Decision trees where the target variable can take continuous values (typically real numbers) are called regression trees.,English
524,524,"Beyond certain basic characteristics that many philosophers agree about to explain what is seen as beautiful, the opinions are virtually endless.",English
525,525,"sure, what do you have in mind?",English
526,526,i'd love to do something but i can't.,English
527,527,The Pew Internet and American Life project found that one third of US Internet users consulted Wikipedia.,English
528,528,"as well as the 2010 The Onion article ""'L.A.",English
529,529,"The difference between optimization and machine learning arises from the goal of generalization: while optimization algorithms can minimize the loss on a training set, machine learning is concerned with minimizing the loss on unseen samples.",English
530,530,Media files covered by free content licenses (e.g.,English
531,531,"Surface vegetation has evolved a dependence on the seasonal variation of the weather, and sudden changes lasting only a few years can have a dramatic effect, both on the vegetation and on the animals which depend on its growth for their food.",English
532,532,how's it going?.,English
533,533,A 2011 study conducted by researchers at the University of Minnesota indicated that male and female editors focus on different coverage topics.,English
534,534,Feature learning can be either supervised or unsupervised.,English
535,535,"In a May 7, 2014, follow-up article in The Atlantic titled ""Can Wikipedia Ever Be a Definitive Medical Text?",English
536,536,66] Shapiro built their first implementation (Model Inference System) in 1981: a Prolog program that inductively inferred logic programs from positive and negative examples.,English
537,537,This definition of the tasks in which machine learning is concerned offers a fundamentally operational definition rather than defining the field in cognitive terms.,English
538,538,Humans have contributed to the extinction of many plants and animals.,English
539,539,"Thus, at any given time during the summer or winter, one part of the Earth is more directly exposed to the rays of the sun.",English
540,540,Semi-supervised anomaly detection techniques construct a model representing normal behavior from a given normal training data set and then test the likelihood of a test instance to be generated by the model.,English
541,541,"That nature has been depicted and celebrated by so much art, photography, poetry, and other literature shows the strength with which many people associate nature and beauty.",English
542,542,"When conduct is not impersonation or anti-social, but rather anti-consensus or in violation of editing policies, remedies tend to be limited to warnings.",English
543,543,your friends that is this stupendous channel for students and some other words that you can use instead of stupendous are incredible fantastic or exceptionally good ok so before we continue with the balanced five words on this video remember to put a comment under this video.,English
544,544,cheers i really appreciate it.,English
545,545,"In 2006, the Wikipedia Watch criticism website listed dozens of examples of plagiarism in the English Wikipedia.",English
546,546,Current fossil and DNA evidence shows that all existing species can trace a continual ancestry back to the first primitive life forms.,English
547,547,"thank you anyway it doesn't matter, but thank you anyway.",English
548,548,"Heilman, who has participated in that process before, says 'less than one percent' of Wikipedia's medical articles have passed.",English
549,549,"Taha Yasseri of the University of Oxford, in 2013, studied the statistical trends of systemic bias at Wikipedia introduced by editing conflicts and their resolution.",English
550,550,"On September 16, 2007, The Washington Post reported that Wikipedia had become a focal point in the 2008 US election campaign, saying: ""Type a candidate's name into Google, and among the first results is a Wikipedia page, making those entries arguably as important as any ad in defining a candidate.",English
551,551,"and The Economist newspaper placed it as the ""13th-most-visited place on the web"".",English
552,552,according to their relationship to human life.,English
553,553,became one of the questions frequently asked on the project.,English
554,554,"On August 23, 2013, the New Yorker website published a cartoon with this caption: ""Dammit, Manning, have you considered the pronoun war that this is going to start on your Wikipedia page?",English
555,555,"84] Reasons for this are numerous: lack of (suitable) data, lack of access to the data, data bias, privacy problems, badly chosen tasks and algorithms, wrong tools and people, lack of resources, and evaluation problems.",English
556,556,if you want somebody just sound like crying and complaining about something that is not happening you can say come i'm you can do it i?,English
557,557," An SVM training algorithm is a non-probabilistic, binary, linear classifier, although methods such as Platt scaling exist to use SVM in a probabilistic classification setting.",English
558,558,excuse me?,English
559,559,"conflict based[87] editing culture associated with traditional masculine gender roles,[88] which contributes to the gender bias on Wikipedia.",English
560,560,"In Linnaeus' system, these became the kingdoms Vegetabilia (later Plantae) and Animalia.",English
561,561,"Sparse dictionary learning is a feature learning method where a training example is represented as a linear combination of basis functions, and is assumed to be a sparse matrix.",English
562,562,"On September 28, 2007, Italian politician Franco Grillini raised a parliamentary question with the minister of cultural resources and activities about the necessity of freedom of panorama.",English
563,563,when he sneezed oh oh and the last stop no i don't want to hear any more all i could see was that those men were really nice my dear you must know that beauty.,English
564,564,"A common classical idea of beautiful art involves the word mimesis, the imitation of nature.",English
565,565,Other lakes are found in endorheic basins or along the courses of mature rivers.,English
566,566,"you can do it if somebody is doing really well, you can tell them keep up the good work keep up the good work like be as good as you are and keep up the good work continue being another phrase is colloquial, and this is what americans say.",English
567,567,"Instead, probabilistic bounds on the performance are quite common.",English
568,568,Some of the sketches were directly inspired by Wikipedia and its articles.,English
569,569,would you mind repeating that?,English
570,570,"For a dictionary where each class has already been built, a new training example is associated with the class that is best sparsely represented by the corresponding dictionary.",English
571,571,"In response to paid advocacy editing and undisclosed editing issues, Wikipedia was reported in an article in The Wall Street Journal, to have strengthened its rules and laws against undisclosed editing.",English
572,572,alright let's begin.,English
573,573,Data has also shown that Africa-related material often faces omission; a knowledge gap that a July 2018 Wikimedia conference in Cape Town sought to address.,English
574,574,This also increases efficiency by decentralizing the training process to many devices.,English
575,575,"It may more specifically follow the biases of Internet culture, inclining to be young, male, English-speaking, educated, technologically aware, and wealthy enough to spare time for editing.",English
576,576,"In addition to overall accuracy, investigators frequently report sensitivity and specificity meaning True Positive Rate (TPR) and True Negative Rate (TNR) respectively.",English
577,577,"Some types of ""native flora"" actually have been introduced centuries ago by people migrating from one region or continent to another, and become an integral part of the native, or natural flora of the place to which they were introduced.",English
578,578,Negative results show that certain classes cannot be learned in polynomial time.,English
579,579,"Katherine Maher, the nonprofit Wikimedia Foundation's chief communications officer, said the changes address a sentiment among volunteer editors that, 'we're not an advertising service; we're an encyclopedia.",English
580,580,Bots on Wikipedia must be approved before activation.,English
581,581,"However, some vandalism takes much longer to repair.",English
582,582,"Wikipedia's open structure inherently makes it an easy target for Internet trolls, spammers, and various forms of paid advocacy seen as counterproductive to the maintenance of a neutral and verifiable online encyclopedia.",English
583,583,Sanger also expressed concerns about access to the images on Wikipedia in schools.,English
584,584,had such small eyes almost like a bird's and the other had a huge nose i wouldn't want to be near him.,English
585,585,"Wikipedia began as a complementary project for Nupedia, a free online English-language encyclopedia project whose articles were written by experts and reviewed under a formal process.",English
586,586,"Some of the more important components are soil, atmosphere, radiation from the sun, water, and living organisms.",English
587,587,"On February 9, 2014, The New York Times reported that Wikipedia has 18 billion page views and nearly 500 million unique visitors a month, ""according to the ratings firm comScore"".",English
588,588,The user interface and part of the content of the Domesday Project were emulated on a website until 2008.,English
589,589,"For example, a microsystem can be a stone and all the life under it.",English
590,590,and you're ready to go and if you've liked this video don't forget to give us a thumbs up with a comment.,English
591,591,"Access to Wikipedia from mobile phones was possible as early as 2004, through the Wireless Application Protocol (WAP), via the Wapedia service.",English
592,592,or points of view.,English
593,593,one is swamped swamped means drowning or flooding but swamped is often used in the context of work like i'm swamped with work i have too much work to do i've been swamped with work this entire week i've barely had time to breathe now let's look at the root of this word.,English
594,594,"In 2008, the comedic website CollegeHumor produced a video sketch named ""Professor Wikipedia"", in which the fictitious Professor Wikipedia instructs a class with a medley of unverifiable and occasionally absurd statements.",English
595,595,asking someone to wait.,English
596,596,"This method of evaluating contributions was later disputed by Aaron Swartz, who noted that several articles he sampled had large portions of their content (measured by number of characters) contributed by users with low edit counts.",English
597,597,Many names for small rivers are specific to geographic location; one example is Burn in Scotland and North-east England.,English
598,598,Ponds and lakes are distinguished from streams via current speed.,English
599,599,"The types of machine learning algorithms differ in their approach, the type of data they input and output, and the type of task or problem that they are intended to solve.",English
600,600,Ecosystems are composed of a variety of biotic and abiotic components that function in an interrelated way.,English
601,601,"In 2014, it was reported that a machine learning algorithm had been applied in the field of art history to study fine art paintings and that it may have revealed previously unrecognized influences among artists.",English
602,602,"According to the rules on the English Wikipedia, each entry in Wikipedia must be about a topic that is encyclopedic and is not a dictionary entry or dictionary-style.",English
603,603,"Articles available in more than one language may offer ""interwiki links"", which link to the counterpart articles in other editions.",English
604,604,The GFDL was created for software manuals that come with free software programs licensed under the GPL.,English
605,605,image files) varies across language editions.,English
606,606,"Supervised anomaly detection techniques require a data set that has been labeled as ""normal"" and ""abnormal"" and involves training a classifier (the key difference to many other statistical classification problems is the inherently unbalanced nature of outlier detection).",English
607,607,The latter are both languages of the Philippines.,English
608,608,"In common ANN implementations, the signal at a connection between artificial neurons is a real number, and the output of each artificial neuron is computed by some non-linear function of the sum of its inputs.",English
609,609,"Another sister project of Wikipedia, Wikispecies, is a catalogue of species.",English
610,610,"Since then, it has become clear that the Plantae as originally defined included several unrelated groups, and the fungi and several groups of algae were removed to new kingdoms.",English
611,611,so much that they forget what to do now confused tends to be an overused word so instead of that why don't you use flummox for example the boy looked completely .flummoxed when the teacher asked him a question in class or the dog was flummoxed looking at his own reflection in the mirror or the tourist was flummoxed by the different customs that.,English
612,612,when you hear a sentence practice saying it after me.,English
613,613,"Similarly, animals are often categorized in ways such as domestic, farm animals, wild animals, pests, etc.",English
614,614,"Wikipedia has been widely used as a corpus for linguistic research in computational linguistics, information retrieval and natural language processing.",English
615,615,"are as reliable a source of knowledge as those contributors who register with the site"".",English
616,616,"Unsupervised anomaly detection techniques detect anomalies in an unlabeled test data set under the assumption that the majority of the instances in the data set are normal, by looking for instances that seem to fit least to the remainder of the data set.",English
617,617,"In a 2017 opinion piece for Wired, Hossein Derakhshan describes Wikipedia as ""one of the last remaining pillars of the open and decentralized web"" and contrasted its existence as a text-based source of knowledge with social media and social networking services, the latter having ""since colonized the web for television's values"".",English
618,618,"Some commentators suggest that Wikipedia may be reliable, but that the reliability of any given article is not clear.",English
619,619,"Bots are able to indicate edits from particular accounts or IP address ranges, as occurred at the time of the shooting down of the MH17 jet incident in July 2014 when it was reported edits were made via IPs controlled by the Russian government.",English
620,620,"Classification of machine learning models can be validated by accuracy estimation techniques like the holdout method, which splits the data in a training and test set (conventionally 2/3 training set and 1/3 test set designation) and evaluates the performance of the training model on the test set.",English
621,621,and some ecologists consider wilderness areas to be an integral part of the Earth's self-sustaining natural ecosystem (the biosphere).,English
622,622,this is the best video to start with so let's go 50 phrases in english in hopefully 10 minutes.,English
623,623,and the Spanish Princess of Asturias Award on International Cooperation.,English
624,624,Subsequent collaborative knowledge websites have drawn inspiration from Wikipedia.,English
625,625,The question to what is the difference between ML and AI is answered by Judea Pearl in The Book of Why.,English
626,626,"He comments that some traditional sources of non-fiction suffer from systemic biases and novel results, in his opinion, are over-reported in journal articles and relevant information is omitted from news reports.",English
627,627,how are you?,English
628,628,"Several million years ago, a species of small African ape gained the ability to stand upright.",English
629,629,"Rule-based machine learning approaches include learning classifier systems, association rule learning, and artificial immune systems.",English
630,630,"yes, please do sure, go ahead.",English
631,631,"In the same interview, Wales also claimed the number of editors was ""stable and sustainable"".",English
632,632,"and January 13, 2001,[23] respectively, and Wikipedia was launched on January 15, 2001,[14] as a single English-language edition at www.wikipedia.com,[24] and announced by Sanger on the Nupedia mailing list.",English
633,633,if you ask somebody not to be upset not to cry you can say don't take it to heart.,English
634,634,"All lakes are temporary over geologic time scales, as they will slowly fill in with sediments or spill out of the basin containing them.",English
635,635,also if you liked this video give it a thumbs up by hitting the like button and remember to subscribe to this channel by clicking the subscribe button to get my latest lessons right here on youtube.,English
636,636,"239][240] It was met with much rejection and criticism, and was described as ""slow and buggy"".",English
637,637,i can't thank you enough.,English
638,638,"As of November 2020, Alexa records the daily pageviews per visitor as 3.03 and the average daily time on site as 3:46 minutes.",English
639,639,"In September 2008, Wikipedia received Quadriga A Mission of Enlightenment award of Werkstatt Deutschland along with Boris Tadić, Eckart Höfling, and Peter Gabriel.",English
640,640,what do you say we go to the movies?,English
641,641,that would be wonderful wouldn't it well no matter i guess in time she will grow to learn let's talk about something else.,English
642,642,Central to the ecosystem concept is the idea that living organisms interact with every other element in their local environment.,English
643,643,25] The Earth's atmosphere is a key factor in sustaining the ecosystem.,English
644,644,Three broad categories of anomaly detection techniques exist.,English
645,645,"In 2014, a female editor who requested a separate space on Wikipedia to discuss improving civility had her proposal referred to by a male editor using the words ""the easiest way to avoid being called a cunt is not to act like one"".",English
646,646,terry you actually look a little like that angel though what am i seeing how could you be him you two are so nice,English
647,647,"The study of streams and waterways in general involves many branches of inter-disciplinary natural science and engineering, including hydrology, fluvial geomorphology, aquatic ecology, fish biology, riparian ecology, and others.",English
648,648,"Maher stated regarding the harassment issue that: ""It establishes a sense within the community that this is a priority ... (and that correction requires that) it has to be more than words.",English
649,649,"Wikipedia was also nominated for a ""Best Practices"" Webby award.",English
650,650,This artistic movement also coincided with the Transcendentalist movement in the Western world.,English
651,651,"Many devices and applications optimize or enhance the display of Wikipedia content for mobile devices, while some also incorporate additional features such as use of Wikipedia metadata (see Wikipedia:Metadata), such as geoinformation.",English
652,652,"The subsequent advent of human life, and the development of agriculture and further civilization allowed humans to affect the Earth more rapidly than any previous life form, affecting both the nature and quantity of other organisms as well as global climate.",English
653,653,we've learnt a whole lot of these smart words and we tend to stuff two three four of them in one sentence that doesn't sound natural.,English
654,654,"In 2016, the level of contributions were reported by Bloomberg News as being at $77 million annually, updating the Jaffe estimates for the higher level of support to between $3.08 million and $19.2 million annually.",English
655,655,"Starting in January 2002 (Phase II), Wikipedia began running on a PHP wiki engine with a MySQL database; this software was custom-made for Wikipedia by Magnus Manske.",English
656,656,"don't worry no worries, which means don't worry about it.",English
657,657,"Though the term has fallen into disfavor among botanists as a formal way to categorize ""useless"" plants, the informal use of the word ""weeds"" to describe those plants that are deemed worthy of elimination is illustrative of the general tendency of people and societies to seek to alter or shape the course of nature.",English
658,658,"These affiliates participate in the promotion, development, and funding of Wikipedia.",English
659,659,Machine learning systems used for criminal risk assessment have been found to be biased against black people.,English
660,660,if somebody's crying and doesn't want it.,English
661,661,no worries imagine you came home and there are all of your friends sitting on your couch.,English
662,662,"Conversely, machine learning techniques have been used to improve the performance of genetic and evolutionary algorithms.",English
663,663,"TOC shows the numerators and denominators of the previously mentioned rates, thus TOC provides more information than the commonly used receiver operating characteristic (ROC) and ROC's associated area under the curve (AUC).",English
664,664,Other methods are based on estimated density and graph connectivity.,English
665,665,interrupting politely.,English
666,666,"means that it is hard to discern any overall interpretive stance in Wikipedia history"".",English
667,667,"By contrast, he gives an example of Wikipedia's prose that he finds ""both verbose and dull"".",English
668,668,to answer a single question on the test or the obtuse man had a hard time understanding even basic instructions now suppose in your situation in daily life your boyfriend or your girlfriend is angry with you and you don't know why so you can.,English
669,669,"Methods similar to wikification can in turn be used to find ""missing"" links in Wikipedia.",English
670,670,"Wales replied that he did not, although the perpetrator was eventually traced.",English
671,671,"The authors focused on behavioral changes of the encyclopedia's administrators after assuming the post, writing that systematic bias occurred after the fact.",English
672,672,"and they're like i want to buy the same thing and i tell them you sold it you sold me i wouldn't buy this alright, you sold me if you're not interested in the conversation.",English
673,673,happy learning and i will see you in another lesson soon.,English
